Directory,Questions
211115,"[{'question': 'How do we know that for the midpoint rule, the time average solution looks like what was plotted, i.e., straight lines between t1, t2, and so on? Can they be, say, sinusoidal if there are oscillations? The time average of sinusoidal would not be straight lines like this, right?', 'coverage': 100}, {'question': 'How would the modal equations be defined if we have as an initial condition the first derivative of d given?', 'coverage': 100}, {'question': 'Why should we introduce Δ𝑡𝜏(𝑡𝑛) in the discussion of the consistency condition? What is the meaning of 𝜏?', 'coverage': 100}, {'question': 'For the discrete time equation in the first line, does it come from directly discretizing the time-exact SDOF modal equation and why do we not use the SDOF modal equation of time-discrete ODE derived in 11.17?', 'coverage': 100}, {'question': 'How is the right-hand side derived below with the time exact mode plugged in?', 'coverage': 100}, {'question': 'How did we deduce the value of k according to the value of alpha in Lecture 11.18?', 'coverage': 100}, {'question': 'How does the accuracy of the solution depend according to the stability? We know that the mid-point rule is most accurate, but is the accuracy equal for other cases irrespective of the type of stability?', 'coverage': 100}, {'question': 'It was said that the high order mode equals high eigenvalue. But for fixed K and M, do we just choose the maximum value among eigenvalues?', 'coverage': 100}, {'question': 'What is the role that volume \\(dv\\) plays in determining the order of the M and K matrices?', 'coverage': 100}, {'question': 'How can we explain that spatial discretization has an effect on our time discretization using physical interpretation? Does it have any implication in crack growth studies where the time step has to be very small since the mesh around the crack tip is highly refined?', 'coverage': 100}, {'question': 'Why is the order of \\(N,_{x_i} \\approx 1/h\\)? Is that the approximation of the mapping from \\(x \\to \\xi\\)?', 'coverage': 100}, {'question': ""In the picture below, I don't understand why we are using corresponding to the spatial discretization, but the equation is still being time-exact."", 'coverage': 100}, {'question': ""What's the use of \\(O(\\lambda^h)\\)? Does it reflect the speed of convergence in terms of the system?"", 'coverage': 100}, {'question': ""In the lecture videos, we've used eigenvalue decomposition for constructing modal equations. Could we use eigenvalue decomposition in our computation as well to speed up the programming?"", 'coverage': 100}, {'question': 'If alpha=1 gives us the amplification factor most similar to time exact, what is the benefit of using other factors for alpha?', 'coverage': 100}, {'question': 'Can we have a formal definition for stability?', 'coverage': 100}]"
211101,"[{'question': 'We have a question on the number of spatial dimensions. Physically, 3 spatial dimensions make sense and I think we are probably going to study that. But, we were wondering what would be some examples of systems with spatial dimensions > 3 where finite element method is used and what would their physical significance be?', 'coverage': 100}, {'question': 'We also have a question on traction integral. Professors had emphasized that there is no sum implied to i for the traction (w(i), t(i)). But what is the difference by exchanging the position of sum of i? Mathematically, is there the difference between ∑𝑖∑𝑒∫∂Ω [𝑤^ℎ(𝑖)𝑡(𝑖)]𝑑𝑆, ∑𝑒∑𝑖∫∂Ω [𝑤^ℎ(𝑖)𝑡(𝑖)]𝑑𝑆, and ∑𝑒∫∂Ω∑𝑖 [𝑤^ℎ(𝑖)𝑡(𝑖)]𝑑𝑆?', 'coverage': 100}, {'question': 'For the Jacobian of the surface mapping \\( J_s \\) in the traction integral term, how do we exactly construct this 2 by 2 matrix?', 'coverage': 100}, {'question': 'Does isoparametric mapping still work in this case with partial surfaces (A belongs to AN)?', 'coverage': 100}, {'question': 'Why does the minor symmetry of the elasticity tensor allow us not to worry about the symmetry of the displacement gradient?', 'coverage': 100}, {'question': 'Does \\( u_{k,l} \\) also need to equal \\( u_{l,k} \\)?', 'coverage': 100}, {'question': 'The number of spatial dimensions for 3D dimensional elasticity is 3. Is there any other problem that has a spatial dimension higher than 3?', 'coverage': 100}, {'question': 'In the image, the professor mentions something about the number of degrees of freedom. Does that mean for a 3D cubic element, we have 8 x 3 degrees of freedom?', 'coverage': 100}, {'question': '- Why does the 1/2 disappear when we are summing the same thing twice?', 'coverage': 100}, {'question': 'How will the weak form change if the stiffness does not change by elements due to homogeneity, even though an ""e"" subscript is added for the stiffness and forcing tensors to account for it being inside an element integral?', 'coverage': 100}, {'question': 'What would a vector basis function for electromagnetism look like, and why does it need to be vectorized for the case of electromagnetism?', 'coverage': 100}, {'question': 'What strategies do finite element method (FEM) engineers use to reduce computational costs, considering that the 3D global system of equations is large (with 24 degrees of freedom per tri-linear element) and becomes even larger with higher order basis functions needed for higher order partial differential equations (PDEs)?', 'coverage': 100}, {'question': ""We're a little confused on how the term can be written as?"", 'coverage': 100}]"
211025,"[{'question': 'Should \\( \\xi_3 \\) always be expressed as \\( 1-\\xi_1-\\xi_2 \\) for the computation of triangular elements?', 'coverage': 100}, {'question': 'Is expressing \\( \\xi_3 \\) in this way more complex than the bilinear element?', 'coverage': 100}, {'question': 'In which cases should we use triangular elements?', 'coverage': 100}, {'question': 'Is considering only the linear terms of the strain expansion, when taking the derivatives of \\( u \\), an appropriate approximation in all cases that we will study?', 'coverage': 100}, {'question': 'In the mapping of elemental curve, why is the mapping only a function of xi_1 (not xi_2 as drawn)?', 'coverage': 100}, {'question': 'Why do we need to construct a new direction?', 'coverage': 100}, {'question': 'Why is the det(J_s) equal to d(x_tilde)/d(xi_1)?', 'coverage': 100}, {'question': 'For the dimension of the assembly matrix below, what is n_np and why do we not use n_sd*n_ne any more as we did in the previous lectures for general 3D weak form assembly?', 'coverage': 100}, {'question': 'Can Neumann and Dirichlet boundaries be expressed as vectors? If yes, how are the components of such vectors defined?', 'coverage': 100}, {'question': 'In the image below, can you explain why there is no xi_3 involved while writing J for linear triangles?', 'coverage': 100}, {'question': 'Why do bilinear polynomials need only xi_1 and xi_2 but for linear polynomials, one needs xi_1, xi_2, and xi_3?', 'coverage': 100}, {'question': 'Can you explain the kinematic relation in a physical context?', 'coverage': 100}, {'question': 'Where did the equation for epsilon come from and why is it only the symmetric part of the gradient of u?', 'coverage': 100}, {'question': 'What are the components of the 4th order elasticity tensor?', 'coverage': 100}, {'question': ""Aren't a lot of the components in the elasticity tensor 0 (recalling from undergrad vaguely)?"", 'coverage': 100}, {'question': 'What is the meaning of the kinematic relationship?', 'coverage': 100}, {'question': 'What exactly does the contraction symbol (:) mean?', 'coverage': 100}]"
211103,"[{'question': 'Will we have to hard code those traction boundaries when we have some faces of the element lying on different traction boundaries in different directions, and how does the code recognize elements in the 𝜖𝑁 set if hard coding is not necessary?', 'coverage': 100}, {'question': 'Why do we still write c and d as vectors and not as tensors, considering they get 3 times longer with 3 spatial dimensions?', 'coverage': 100}, {'question': 'Regarding the last comment on the positive definiteness of the stiffness matrix in the lecture of Dirichlet boundary conditions for the global M-V assembly, could you comment on how the elimination of the rigid body modes affect the stability of the system?', 'coverage': 100}, {'question': 'Also, can a stiffness matrix be negative in general?', 'coverage': 100}, {'question': ""Why is the column equal to nsd\\*A+1 and nsd\\*B+2 in lecture 10.16? Shouldn't it be nsd\\*(A-1)+1 and nsd\\*(B-1)+2?"", 'coverage': 100}, {'question': 'Why is the last node not specified for the c vector in lecture 10.13, but it is specified for the d vector?', 'coverage': 100}, {'question': 'Can you explain what rigid body modes are in our stiffness matrix, and (conceptually) how would Dirichlet boundary conditions eliminate them?', 'coverage': 100}, {'question': 'Could you explain the assembly of the Kglobal matrix (confused on where the terms are coming from in the video)?', 'coverage': 100}, {'question': 'We are confused about how column numbers in the K matrix have been written corresponding to the Dirichlet condition. Please refer to the following figure.', 'coverage': 100}, {'question': ""But since K is constructed from each element's stiffness tensor, which holds major and minor symmetry, shouldn't there be symmetry in the global stiffness tensor? In other words, isn't the ordering of neighboring elements in superscript irrelevant as long as it's consistent?"", 'coverage': 100}, {'question': 'We noticed you immediately ""vectorized"" c and d such that they contain all 3D components in one column vector. We assume it\'s because it\'s for the convenience of formulating it into matrix-vector equations, however, could you just keep it in terms of 4D and 5D tensors and run code through that method?', 'coverage': 100}, {'question': 'When it was said that ""The Dirichlet b.c.s should eliminate rigid body motion"", is it a sort of extension to the fact that in 1-D we must have a Dirichlet condition at one end, i.e., there cannot be only Neumann conditions in any one spatial dimension? Or is there something more to it in the 3D case?', 'coverage': 100}, {'question': ""How many terms (which get summed up) are there in each component of the global stiffness matrix? As in the case of the lectures, we had 2 'K' considerations when looking at AB, how many more such terms are there?"", 'coverage': 100}]"
211004,"[{'question': ""We are a bit confused about what the actual meaning of a norm is. Once we have the norms the rest of the math makes sense, but it isn't clear exactly where they come from."", 'coverage': 100}, {'question': 'Where is ""interpolation error estimate in Sobolev spaces"" derived? What is the meaning of it and how to prove it?', 'coverage': 100}, {'question': 'Why the equivalence of H^1 and energy norms can be extended to H^n?', 'coverage': 100}, {'question': 'How can the derivation of epsilon become a variation of pi with respect to u?', 'coverage': 100}, {'question': 'Regarding the finite element error estimates for convergence, when we have the H-n norm of the finite element error bounded by the H-r norm of the solution, could you elaborate on what would happen if the solution u is not sufficiently smooth?', 'coverage': 100}, {'question': 'Could you explain again why, in the following screenshot?', 'coverage': 100}, {'question': 'Why is the variational principle derivation not appropriate for heat conduction or mass diffusion physics?', 'coverage': 100}, {'question': 'For the Sobolev space, is Hilbert space a subset of the Sobolev space (i.e., does the Sobolev space contain all the Hn space)?', 'coverage': 100}, {'question': ""What is the physical representation of the function \\( w \\) which is perturbing the field we're looking at in terms of steady state linear elasticity?"", 'coverage': 100}, {'question': 'Why would the function \\( w \\) not apply to time-dependent problems?', 'coverage': 100}, {'question': 'For the rate of convergence in FEM solutions, does \\( m \\) indicate the order of the Hilbert Space? In other words, for the \\( L^2 \\) norm, would \\( m \\) stay consistent for all cases?', 'coverage': 100}, {'question': ""Since we've derived all we need for the 1D elliptical problem up to this point, what should we look forward to for the rest of the semester?"", 'coverage': 100}, {'question': '1) How do we know whether the energy is stable or unstable when it is at equilibrium?', 'coverage': 100}, {'question': '2) How do we know that the function \\( u \\) that minimizes the functional is unique? Just like how a function can have more than one equilibrium, can a functional have more than one equilibrium?', 'coverage': 100}, {'question': '3) Why are we considering variational methods to obtain the weak form? What does it offer as an advantage that we did not have in our methods so far?', 'coverage': 100}, {'question': '4) Is it right to think of a functional as a function of a function?', 'coverage': 100}]"
211020,"[{'question': 'How does the number of quad points affect the polynomial order we are integrating in the 2D and 3D cases? Is it the same rule as in the 1D case?', 'coverage': 100}, {'question': 'Is there a specific rule for choosing the quad points, or are they the same as the ones used in the 1D case?', 'coverage': 100}, {'question': 'Why are we not able to use the Gaussian quadrature rule for the simple basis functions? Why is that option not optimal?', 'coverage': 100}, {'question': 'Why can the simplex elements lead to an incomplete basis?', 'coverage': 100}, {'question': 'Why is the Gaussian quadrature rule no longer optimal for higher-order tetrahedral elements?', 'coverage': 100}, {'question': 'Can we use a tensor product basis on simplex elements? It seems like it would require creative node placement for higher-order basis functions, but could that not restore some of the information lost in going to a minimal basis?', 'coverage': 100}, {'question': 'Why are the basis functions of triangular elements xi in each direction?', 'coverage': 100}, {'question': 'What other methods are used for numerical integration in higher order tetrahedra?', 'coverage': 100}, {'question': 'Is there a specific order where we use a different method than Gaussian quadrature?', 'coverage': 100}, {'question': 'Why are we looking at the node 5 (the one between 1 and 2, with the arrow), not the node at the vertex as shown in the upper schematic?', 'coverage': 100}, {'question': 'Is it worth deriving the generalized basis function for 2D and 3D cases, or just use a tensor product in all three directions?', 'coverage': 100}, {'question': 'In terms of the coding assignment, is a tensor product just multiplication?', 'coverage': 100}, {'question': 'In the example where $$N^5(\\xi_1,\\xi_2,\\xi_3)=\\tilde{N}^2(\\xi_1) \\tilde{N}^1(\\xi_2) \\tilde{N}^1(\\xi_3)$$, what was the logic of choosing B = 2, C = 1, and D = 1?', 'coverage': 100}, {'question': ""Shouldn't N3 and N4 be interchanged?"", 'coverage': 100}, {'question': 'How do we know the proper order of the permutations or does the order even matter?', 'coverage': 100}, {'question': 'What other types of parent domains are used (in the industry or special cases) and what advantages do each hold over the others?', 'coverage': 100}]"
211027,"[{'question': ""Since mu is the shear modulus, does lambda have any physical meaning as well, or is it just derived from the Young's modulus and Poisson's ratio?"", 'coverage': 100}, {'question': 'Where did we get the result that ℂ is positive definite?', 'coverage': 100}, {'question': 'How can we get the conclusion that stress is symmetric? What does ""balance of angular momentum"" mean?', 'coverage': 100}, {'question': 'Where does the formula for C for isotropic materials come from? To be more precise, how does isotropy relate to the elements of the formula?', 'coverage': 100}, {'question': 'After integration by parts is done when getting the weak form from the strong form, why is there still the integration and derivation for the first term ∫(𝑤𝑖𝜎𝑖𝑗),𝑗𝑑𝑉?', 'coverage': 100}, {'question': ""Since mu is the shear modulus, does lambda have any physical meaning as well or is it just derived from the Young's modulus and Poisson's ratio?"", 'coverage': 100}, {'question': 'Could you elaborate a little bit on why the standard finite element methods that we used will not work well for the constrained linear elasticity problems?', 'coverage': 100}, {'question': 'In the image below, can you explain how the smoothness of the ψ function implies the given equation?', 'coverage': 100}, {'question': '1. What are Lamé constants in the context of material science or engineering?', 'coverage': 100}, {'question': '2. Could you explain the abstract notation of tensors and how they are generally represented?', 'coverage': 100}, {'question': '3. What is the operation or definition of the general tensor Theta in relation to another tensor C?', 'coverage': 100}, {'question': 'How were the relationships \\(c_{long}=\\sqrt{\\frac{\\lambda+2\\mu}{p}}\\) and \\(c_{shear}=\\sqrt{\\frac{\\mu}{p}}\\) derived?', 'coverage': 100}, {'question': 'What do \\(p\\) and \\(c\\) mean in these equations?', 'coverage': 100}, {'question': 'What do these relationships mean in a physical context?', 'coverage': 100}, {'question': 'Is there a reason that, in the 3-D form of the 1-D linear elastic weak form, we no longer have A (or Volume if it scales up in dimension) in our integrands?', 'coverage': 100}, {'question': 'How did the application of the divergence theorem result come about at the end of 10.05?', 'coverage': 100}, {'question': 'From what I know of the divergence theorem, it should be that F is a vector and n is the unit normal to surface S. Are we comparing w to the vector differential operator?', 'coverage': 100}]"
211108,"[{'question': 'Why do we consider the degree of freedom for the weight functions to be time-independent? And why do we only consider degrees of freedom for u() to be time-dependent?', 'coverage': 100}, {'question': 'Why should we discuss the lumped element matrix? What is the application of this form?', 'coverage': 100}, {'question': 'We are a little confused with how the lumped element mass matrix is arrived at, specifically the diagonalization part.', 'coverage': 100}, {'question': 'How might the diagonalization of the lumped element mass matrix contribute to the final global matrix vector form for this 3D linear parabolic problem?', 'coverage': 100}, {'question': 'What is meant by a consistent element mass matrix?', 'coverage': 100}, {'question': 'Is there a specific reason for introducing the lumped matrix?', 'coverage': 100}, {'question': 'What would a time-dependent degree-of-freedom function look like? Are these functions consistent across all elements in a mesh?', 'coverage': 100}, {'question': 'In the global assembly of the time-dependent term, are we assuming to know \\( \\dot{\\overline{d}} \\)? I ask this because no information is provided for the time derivatives in the problem statement.', 'coverage': 100}, {'question': ""In many places throughout the lectures, the length of the global C vector is written as \\( nn_e - n_D \\). Shouldn't it be \\( n - n_D \\)?"", 'coverage': 100}, {'question': 'What are some examples of the boundary conditions mentioned in the remark?', 'coverage': 100}, {'question': 'Can you elaborate on the semi-discrete FE formulation?', 'coverage': 100}, {'question': 'Just wanted to confirm that the time-dependent term will contribute to the F vector on the right side, which was mentioned later in the lectures?', 'coverage': 100}, {'question': 'Currently, in the following picture, F is not time-dependent?', 'coverage': 100}, {'question': 'But when we account for the Dirichlet BCs in time-dependent terms, the F vector becomes time-dependent.', 'coverage': 100}, {'question': 'Is it the same as the redefined F in 11.06?', 'coverage': 100}, {'question': 'In general, for any weak form of parabolic PDEs, is the difference between its respective elliptic ""steady-state"" PDE version only just one additional time derivative term? If this is not the appropriate generalization, then what is the general change of the weak form from elliptic to parabolic PDEs?', 'coverage': 100}, {'question': ""Isn't the assembly of the global mass matrix consistent with the global stiffness matrix? In other words, for coding, would it be more efficient to do both global assemblies in the same iterative loops?"", 'coverage': 100}, {'question': ""What's the advantage of the lumped element mass matrix over the consistent mass matrix? Is it because it's a diagonal matrix and matrix multiplication is computationally more efficient and we have one more loop for time integrations?"", 'coverage': 100}, {'question': 'What limitations on time step size do we have in this semi-discrete method?', 'coverage': 100}, {'question': 'Is f in unsteady state heat conduction defined differently from the f in steady state? If we take the steady form as a special case of the unsteady form where du/dt = 0, we will have 0 = -ji,i+ f, which is different from the one in 7.01.', 'coverage': 100}]"
210920,"[{'question': ""How can we prove the positive definiteness of a general 'n' sized matrix by inspecting the eigenvalues and its relation with E? If not through eigenvalues being positive, then what is an alternate way to conclude that E must be positive?"", 'coverage': 100}, {'question': 'What are some of the implications of having a positive definite matrix or positive semi-definite matrix in the context of this course? Is the stiffness matrix always positive definite or positive semi-definite?', 'coverage': 100}, {'question': 'It was mentioned that K is tri-diagonal because we have the single derivative of &, and linear basis functions. We understand that we have these conditions, but together, how do these mathematically conclude that a matrix is tri-diagonal?', 'coverage': 100}, {'question': 'What is exactly meant by interchangeability in the context of the symmetry arising when the positions of \\(w_{h,x}\\) and \\(u_{h,x}\\) in the integral \\(\\int w_{h,x} E u_{h,x} \\, dx\\) are interchangeable? Is it just because they are in multiplication or does it mean something else?', 'coverage': 100}, {'question': 'How can ""all \\(w\\) belong to \\(V_h\\)"" be equal to ""all \\(c\\) belong to \\(\\mathbb{R}^{n_{\\text{el}}}\\)""?', 'coverage': 100}, {'question': 'Is ""<all \\(c\\) belong to \\(\\mathbb{R}^{n_{\\text{el}}}\\)>"" a more broad concept than ""<all \\(w\\) belong to \\(V_h\\)>""?', 'coverage': 100}, {'question': 'Here are the individual questions extracted from the provided text:', 'coverage': 100}, {'question': '- Our first question is regarding the force vector of the final form of the FE equation, which is given as the summation of the forcing function, traction term, and the Dirichlet boundary condition for this case. From video 03.08ct, the Dirichlet boundary map can be defined using node number and values. This map only includes Dirichlet boundary values, and I wonder if the application of the Neumann boundary condition is defined in a similar way or if we only need to apply it when constructing the F_local matrix in assembly as shown in the final form?', 'coverage': 100}, {'question': '- Could you remind us of the reason that we include = 0 for the function space for the pure Dirichlet boundary problem?', 'coverage': 100}, {'question': 'In the above picture, how did we go from the second last equation to the last equation?', 'coverage': 100}, {'question': 'The professor explained something related to all c belonging to the real space of order n_el. Can you elaborate more on the same?', 'coverage': 100}, {'question': 'What is the L2 norm error?', 'coverage': 100}, {'question': 'Why do we perform a procedure of ""cancelling columns"" to apply boundary conditions and form a square matrix, instead of using a general procedure for Kd = F?', 'coverage': 100}, {'question': 'What is a banded tridiagonal structure?', 'coverage': 100}, {'question': 'When expanding the integral form of w^hfA dx, why does the second term, which includes a {1 1} vector, expand to include a {2 2 ... 2} vector?', 'coverage': 100}, {'question': 'When would the K matrix not be symmetric, and is it related to using different sets of basis functions?', 'coverage': 100}, {'question': 'What exactly is a gradient of a basis function?', 'coverage': 100}]"
