Directory,Questions
211006,"[{'question': 'Why is the heat conduction along xi zero when xi*k*xi=0, given that xi is always non-zero?', 'coverage': 100}, {'question': 'How would the H1 Hilbert space integral expression look like now that \\( u \\) or \\( w \\) is a vector?', 'coverage': 100}, {'question': ""How do we do the partitioning of the boundary since now we're dealing with 2D surfaces?"", 'coverage': 100}, {'question': 'How does the partitioning work when we have 3 or more surfaces intersecting at the same node?', 'coverage': 100}, {'question': 'How does the node numbering work?', 'coverage': 100}, {'question': 'Is there an equivalent polar form of the steady state heat conduction in 3D?', 'coverage': 100}, {'question': 'Does the behavior of the tri linear basis function in 3D on an edge of the cube similar to that of bi linear basis function in 1D over a single element?', 'coverage': 100}, {'question': 'In other words, how does the tri linear basis function connect the 8 nodes of the hexahedron?', 'coverage': 100}, {'question': 'The midpoint nodes, which are used for the higher order basis function, are also physical (real) nodes. However, based on the coding assignment, the calculation results are only stored at the edge of the element node. Which one is correct?', 'coverage': 100}, {'question': 'Why is it important for the two boundaries (Dirichlet and Neumann) to be disjoint? Does it have to be disjoint for all cases such as Heat conduction or Mass Diffusion? Why not keep a free boundary with no boundary condition?', 'coverage': 100}, {'question': 'I am not following this product rule step in the weak form derivation. Why are there two w,i terms?', 'coverage': 100}, {'question': ""Is the expression -j*n=jn means jn's value is n on the j axis?"", 'coverage': 100}, {'question': 'What is the connection between the fundamental theorem of calculus (FTC) and the divergence theorem?', 'coverage': 100}, {'question': 'What is the meaning of \\(-j_{i,i} = f\\) on \\(\\omega\\) considering the strong form?', 'coverage': 100}, {'question': 'Could you reclarify the conventions of coordinate notation? It was a little too brief and fast during the lectures.', 'coverage': 100}, {'question': 'How can we visualize a unit normal outward to a 3D boundary? Is it the resultant of the normal vectors of all unit 2D surfaces that combine to make the 3D boundary?', 'coverage': 100}, {'question': 'How well are hexahedral element subdomains able to make up a curved surface for our domains, especially compared to other element types like tetrahedral? Is this something we need to take into account when choosing element types and sizes?', 'coverage': 100}]"
211110,"[{'question': 'Theoretically and practically (coding), will there be any differences in the results solving by v-form and d-form?', 'coverage': 100}, {'question': ""We were a little confused about how we got the vectors 𝜓𝑚 from 𝜙𝑚. Let's say we get 𝜙𝑚 vectors by solving the EVP, then we want to orthonormalize them. But, in the lecture, we directly compute 𝜓𝑚𝑀𝜓𝑘? Where is that set coming from? How are we performing operations on 𝜓 when we don't know yet what it is?"", 'coverage': 100}, {'question': 'We were wondering if for higher-order ODE the same procedure can be applied iteratively? For example, if we have a second-order ODE, can we discretize it: once for the second derivative into first-order derivatives and then do the same procedure as described in the lecture for the first-order derivatives?', 'coverage': 100}, {'question': 'How can we know Fn+1? What is the difference between F(tn+1) and Fn+1?', 'coverage': 100}, {'question': ""In Lecture 11.11, I didn't quite understand how is this defined? Is this by definition?"", 'coverage': 100}, {'question': 'What are the situations that we need to use the explicit method (alpha = 0) to solve?', 'coverage': 100}, {'question': 'What are the situations we need to use the implicit method (alpha is non zero)?', 'coverage': 100}, {'question': 'How does finding the set help us determine the stability of the time-algorithm?', 'coverage': 100}, {'question': 'Why are the implicit method and explicit method referred to as such? Is there any significance in using these specific terminologies?', 'coverage': 100}, {'question': 'What are the differences between using the v-method and the d-method? Are there advantages to either, or is it a matter of preference?', 'coverage': 100}, {'question': ""You mentioned that you could use the finite element method for time discretization over the finite differences method. You argued that we don't do FEM because of visualization of 4D information. Could you elaborate more on why we use the finite differences method for time discretization? Because I don't think we completely appreciate still why to use finite difference method if ease of visualization is the only argument."", 'coverage': 100}, {'question': 'Here is the provided text with the questions split:', 'coverage': 100}, {'question': ""- While explaining the notation for time discrete ODE, the prof. corrected 'time continuous solution' to 'time exact solution', how would that change things?"", 'coverage': 100}, {'question': ""- A little confused about the restrictions on Alpha for the d-method described in lecture 11.09. Can we use alpha = 0 since it doesn't show up in a denominator in our final form?"", 'coverage': 100}, {'question': '- If we can use alpha=0, is this an explicit method like for the v-method?', 'coverage': 100}, {'question': '- Otherwise, is it an implicit method?', 'coverage': 100}]"
210908,"[{'question': 'In lecture, Professor mentions that we are using \\( H^p \\), with \\( p=1 \\), to be our function space. What happens if we pick \\( p = 2 \\) and include the second-order derivative as well? Is that improving the accuracy of the solution?', 'coverage': 100}, {'question': 'Can we consider this scenario to be similar to how a Taylor expansion approximation gets closer to the nominal value of the function as we add higher-order terms?', 'coverage': 100}, {'question': 'The second question is about the example function covered in lecture 2.03 discussion regarding the function \\( v(x) \\) that fails the definition of Hilbert space (the function on the bottom). To resemble a delta function, does \\( V,x \\) need to be zero everywhere else except at \\( x=x_0 \\)?', 'coverage': 100}, {'question': 'Why do we need to use pointers? Is there any similar function in MATLAB?', 'coverage': 100}, {'question': 'If we do not think of polynomial function space, what does the order of dimension of function space mean?', 'coverage': 100}, {'question': 'Should we approximate with Taylor series?', 'coverage': 100}, {'question': 'If finite dimension weak form cannot imply the strong form, what will influence the final accuracy of the approximation?', 'coverage': 100}, {'question': 'Considering that discontinuities cannot be present in our function for it to be a part of, what implications does this have on the possible solutions to our original equation?', 'coverage': 100}, {'question': 'For example, what will happen if the exact solution has a discontinuous feature?', 'coverage': 100}, {'question': 'Additionally, can we enrich our solution space to allow for these discontinuous features?', 'coverage': 100}, {'question': 'When is it more valuable to use a pointer rather than just calling out the variable? I get that a pointer stores the address but if b is a pointer to the address of a, why would I call out b* instead of just a?', 'coverage': 100}, {'question': 'How do we, in general, choose the weighting function such that it vanishes at the boundary?', 'coverage': 100}, {'question': 'In the definition of H1, L2 was introduced for dimensional purposes. Why should we use L2 here?', 'coverage': 100}, {'question': ""What if we don't use L2 here? What kind of misleading will occur? Can you give some specific examples?"", 'coverage': 100}, {'question': 'What is the purpose of using 1 to the power of H in H1?', 'coverage': 100}, {'question': ""More specifically, what would be the conditions we'd like to apply quadratic or even higher power of H?"", 'coverage': 100}, {'question': 'Can we discern the boundary conditions by looking at the weak form?', 'coverage': 100}, {'question': 'If yes, is the following derivation the correct way for converting the weak form into the strong form?', 'coverage': 100}, {'question': 'What is the meaning of the function 𝜙(𝑥) introduced in 1.08?', 'coverage': 100}, {'question': 'It seems the equation 𝑤(𝑥) = 𝜙(𝑥)(−𝜎,𝑥−𝑓) came out of nowhere.', 'coverage': 100}, {'question': 'Will we be able to use Visual Studio to run our C++ code?', 'coverage': 100}, {'question': 'Why do we need it to be an L2 function (P = 2) as opposed to other L-functions (P = 1, 3, etc.) when dealing with these Hilbert spaces?', 'coverage': 100}, {'question': 'How does the proof work for all functions when the professor considers a particular class of functions in lecture 1.08 while proving that the work form implies the strong form?', 'coverage': 100}, {'question': 'Can you elaborate more on the class of functions and its role in the proof?', 'coverage': 100}, {'question': 'Are there any special conditions of σ and f where the above weighting function form cannot be assumed?', 'coverage': 100}, {'question': 'Can we assume a positive sign for σ and f?', 'coverage': 100}, {'question': 'When we mention ""greater than or equal to zero"", ""=0"" is needed to prove the strong form, but why does it have to be positive?', 'coverage': 100}, {'question': 'Is there a relationship between?', 'coverage': 100}]"
210927,"[{'question': 'From where are we getting certain values of ξ and w corresponding to different nint?', 'coverage': 100}, {'question': 'Midside nodes have a larger contribution. Is there any physical reason?', 'coverage': 100}, {'question': 'For the coding assignment, will there be any walkthrough or tutorials on how to use remote Linux (CEAN) in class?', 'coverage': 100}, {'question': 'We have a question regarding the Gaussian quadrature. How do we find those specific values of zeta where we want to calculate our function? Are those the values for which we get the highest accuracy of the approximation?', 'coverage': 100}, {'question': '- My question is whether well-established quadrature rules exist for rational functions?', 'coverage': 100}, {'question': '- If not, do we use an excess number of quadrature points to integrate the function, or do we resort to Taylor-expanding the integrand into non-rational polynomials?', 'coverage': 100}, {'question': '- How do we decide the suitable number of quadrature points (quadRule) when considering the whole integrand?', 'coverage': 100}, {'question': '- Is it from the order of the function with the highest order in the integrand?', 'coverage': 100}, {'question': 'What is the importance of the bandwidth of the stiffness matrix, referring to the discussion in lecture 4.09 where it was noted that the bandwidth of the stiffness matrix is 5 in the case of quadratic basis functions?', 'coverage': 100}, {'question': 'Consider we have polynomial basis functions of order k. Is there a way to determine how many nodes are there on an element?', 'coverage': 100}, {'question': 'The professor mentioned that numerical integration, specifically Gaussian Quadrature, will be used when the function is complicated and basic functions are high order. What is the meaning of ""complicated,"" and how will Gaussian Quadrature be specifically used in high order basic functions?', 'coverage': 100}, {'question': ""How does Gaussian quadrature apply to adapting to a problem where E or F are complicated functions? I'm still not sure where that would come into the solution setup (i.e., where is it used in the steps of obtaining the matrix-vector weak form?)."", 'coverage': 100}, {'question': 'I also wonder if future assignments will be more approachable if some of the code requirements carry over to the next projects. Will it be easier to understand what is being asked due to familiarity with deal.II, etc.?', 'coverage': 100}, {'question': ""What is stopping us from going as high as possible for selecting quadrature point order (i.e., n_int = 5)? Is it only due to computational cost, or is there any other reason why we shouldn't do it (i.e., oversampling)?"", 'coverage': 100}, {'question': 'For the coding assignment, it states we should run the code for 3, 10, 100, and 1000 element-sized meshes. For the submission, it states that we should report results for the 100 element mesh only. Is the 3, 10, and 1000 element meshes for our own practice to see the difference between meshes or should we report the differences?', 'coverage': 100}, {'question': 'Why are ξ and w in terms of n in Gaussian quadrature defined as these values?', 'coverage': 100}]"
210913,"[{'question': 'We are a bit confused on why we are able to go from integrating over to integrating over and summing across e since the interior nodes are not included in the second case. Is it because the integration on these points is zero?', 'coverage': 100}, {'question': 'For the simple basis functions, we have linear polynomials for one element because we only have 2 nodes/element. What happens if we choose an element to have multiple nodes? How would the basis functions be defined?', 'coverage': 100}, {'question': 'In the class, we took all the shape functions to be the same. If that weren’t the case, would the shape functions still be linear polynomials? Or even polynomials? And how do we find them?', 'coverage': 100}, {'question': 'What is the advantage of isoparametric node mappings when we have higher-order solution representations in the elements?', 'coverage': 100}, {'question': 'It seems like quadratic mappings between the local and global coordinates is extra effort; what is the advantage?', 'coverage': 100}, {'question': ""What's the purpose of mapping the physical domain to a Bi-unit domain instead of a single unit domain?"", 'coverage': 100}, {'question': 'Why can we use the same basis function representing \\( u_h \\) and \\( w_h \\) to represent \\( x_e(\\xi) \\)?', 'coverage': 100}, {'question': 'Did we just choose the form of the basis function for our convenience? Can we choose any other type of linear polynomial?', 'coverage': 100}, {'question': 'What exactly does ""degree of freedom"" mean? Also, is \\( d^2_e = d^1_e + 1 \\)?', 'coverage': 100}, {'question': 'Why do we choose the value 1 for the local nodes? After mapping, does the basis function from the bi-unit domain \\( N(x) \\) also have value 1 on nodes?', 'coverage': 100}, {'question': 'Why is there a need for the bi-unit domain?', 'coverage': 100}, {'question': ""Why can't we express the finite elements in the physical domain?"", 'coverage': 100}, {'question': 'Is introducing a bi-unit domain only to make the calculations simpler and/or to standardize them?', 'coverage': 100}, {'question': 'Could you elaborate on the isoparametric map?', 'coverage': 100}, {'question': 'Are there other consequences of the isoparametric mapping besides being invertible?', 'coverage': 100}, {'question': 'Are all isoparametric mappings invertible?', 'coverage': 100}, {'question': 'Why do we need degree of freedom when constructing \\( u^e_h(x) = \\sum N_A(x) d^A \\)? And what does it stand for? Is there any physical meaning?', 'coverage': 100}, {'question': 'Why do we define \\( \\Omega^e \\) as an open interval? Can that be a half-open half-closed interval?', 'coverage': 100}, {'question': 'What is the meaning of DOFs \\( d^A_e \\)? Is there a physical meaning or only mathematical?', 'coverage': 100}, {'question': 'How does the Kronecker delta property in \\( N_A(\\xi_B) = \\delta_{AB} = \\begin{cases} 1 & \\text{if } A = B, \\\\ 0 & \\text{if } A \\neq B \\end{cases} \\) help the mapping from bi-unit domain to physical domain? Why is the index of summation ""A""? (as in \\( u^e_h(x) = \\sum_{A=1}^{Nn} N_A(x) d^A \\))?', 'coverage': 100}, {'question': 'Is the Kronecker Delta property defined only at the nodes?', 'coverage': 100}, {'question': 'When we derived the mapping between the physical domain and the bi-unit domain, we said that \\( x_e(\\xi) = \\Sigma_A N_A(\\xi) x^A \\). By this expression, do we mean that we are approximating the actual geometry by some constructed function?', 'coverage': 100}, {'question': 'Is there a way to just take \\( x=0 \\) and \\( x=L \\) as the only nodes and find out an answer, what will be the error percentage in that assumption?', 'coverage': 100}, {'question': 'With regards to the closure property, is it safe to assume that the nodes are not unique between the elements (hence do elements share nodes)?', 'coverage': 100}, {'question': 'Does this assumption enable meshing?', 'coverage': 100}, {'question': 'How do we get the value of Degree of Freedom in lecture 2.05?', 'coverage': 100}, {'question': 'Why do we need to multiply the basis functions by the Degree of Freedom when we write the expression of the trial solution?', 'coverage': 100}]"
